No.     Time           Source                Destination           Protocol Length Info
      1 0.000000000    fe80::7cb1:e9ff:fef1:5cb1 ff02::2               ICMPv6   70     Router Solicitation from 7e:b1:e9:f1:5c:b1

Frame 1: 70 bytes on wire (560 bits), 70 bytes captured (560 bits) on interface veth2-1, id 0
Ethernet II, Src: 7e:b1:e9:f1:5c:b1 (7e:b1:e9:f1:5c:b1), Dst: IPv6mcast_02 (33:33:00:00:00:02)
Internet Protocol Version 6, Src: fe80::7cb1:e9ff:fef1:5cb1, Dst: ff02::2
Internet Control Message Protocol v6

No.     Time           Source                Destination           Protocol Length Info
      2 22.501699558   82:4e:fe:dc:9b:f8     Broadcast             ARP      46     Who has 12.0.0.0? Tell 155.248.10.100

Frame 2: 46 bytes on wire (368 bits), 46 bytes captured (368 bits) on interface veth2-1, id 0
Ethernet II, Src: 82:4e:fe:dc:9b:f8 (82:4e:fe:dc:9b:f8), Dst: Broadcast (ff:ff:ff:ff:ff:ff)
Address Resolution Protocol (request)

No.     Time           Source                Destination           Protocol Length Info
      3 22.517882208   7e:b1:e9:f1:5c:b1     82:4e:fe:dc:9b:f8     ARP      46     92.177.10.100 is at 00:01:7e:b1:e9:f1

Frame 3: 46 bytes on wire (368 bits), 46 bytes captured (368 bits) on interface veth2-1, id 0
Ethernet II, Src: 7e:b1:e9:f1:5c:b1 (7e:b1:e9:f1:5c:b1), Dst: 82:4e:fe:dc:9b:f8 (82:4e:fe:dc:9b:f8)
Address Resolution Protocol (reply)

No.     Time           Source                Destination           Protocol Length Info
      4 22.527294638   10.100.1.2            10.100.1.1            TCP      58     0 → 233 [SYN] Seq=0 Win=32768 Len=0

Frame 4: 58 bytes on wire (464 bits), 58 bytes captured (464 bits) on interface veth2-1, id 0
Ethernet II, Src: 82:4e:fe:dc:9b:f8 (82:4e:fe:dc:9b:f8), Dst: 7e:b1:e9:f1:5c:b1 (7e:b1:e9:f1:5c:b1)
Internet Protocol Version 4, Src: 10.100.1.2, Dst: 10.100.1.1
Transmission Control Protocol, Src Port: 0, Dst Port: 233, Seq: 0, Len: 0

No.     Time           Source                Destination           Protocol Length Info
      5 26.184978891   10.100.1.1            10.100.1.2            TCP      58     233 → 0 [SYN, ACK] Seq=0 Ack=1 Win=32768 Len=0

Frame 5: 58 bytes on wire (464 bits), 58 bytes captured (464 bits) on interface veth2-1, id 0
Ethernet II, Src: 7e:b1:e9:f1:5c:b1 (7e:b1:e9:f1:5c:b1), Dst: 82:4e:fe:dc:9b:f8 (82:4e:fe:dc:9b:f8)
Internet Protocol Version 4, Src: 10.100.1.1, Dst: 10.100.1.2
Transmission Control Protocol, Src Port: 233, Dst Port: 0, Seq: 0, Ack: 1, Len: 0

No.     Time           Source                Destination           Protocol Length Info
      6 26.192103226   10.100.1.2            10.100.1.1            TCP      58     0 → 233 [ACK] Seq=1 Ack=1 Win=32768 Len=0

Frame 6: 58 bytes on wire (464 bits), 58 bytes captured (464 bits) on interface veth2-1, id 0
Ethernet II, Src: 82:4e:fe:dc:9b:f8 (82:4e:fe:dc:9b:f8), Dst: 7e:b1:e9:f1:5c:b1 (7e:b1:e9:f1:5c:b1)
Internet Protocol Version 4, Src: 10.100.1.2, Dst: 10.100.1.1
Transmission Control Protocol, Src Port: 0, Dst Port: 233, Seq: 1, Ack: 1, Len: 0

No.     Time           Source                Destination           Protocol Length Info
      7 32.767046891   fe80::804e:feff:fedc:9bf8 ff02::2               ICMPv6   70     Router Solicitation from 82:4e:fe:dc:9b:f8

Frame 7: 70 bytes on wire (560 bits), 70 bytes captured (560 bits) on interface veth2-1, id 0
Ethernet II, Src: 82:4e:fe:dc:9b:f8 (82:4e:fe:dc:9b:f8), Dst: IPv6mcast_02 (33:33:00:00:00:02)
Internet Protocol Version 6, Src: fe80::804e:feff:fedc:9bf8, Dst: ff02::2
Internet Control Message Protocol v6

No.     Time           Source                Destination           Protocol Length Info
      8 123.960246875  10.100.1.1            10.100.1.2            TCP      65     233 → 0 [ACK] Seq=1 Ack=1 Win=32768 Len=7

Frame 8: 65 bytes on wire (520 bits), 65 bytes captured (520 bits) on interface veth2-1, id 0
Ethernet II, Src: 7e:b1:e9:f1:5c:b1 (7e:b1:e9:f1:5c:b1), Dst: 82:4e:fe:dc:9b:f8 (82:4e:fe:dc:9b:f8)
Internet Protocol Version 4, Src: 10.100.1.1, Dst: 10.100.1.2
Transmission Control Protocol, Src Port: 233, Dst Port: 0, Seq: 1, Ack: 1, Len: 7
Data (7 bytes)

0000  70 6b 75 65 65 63 73                              pkueecs

No.     Time           Source                Destination           Protocol Length Info
      9 123.977945249  10.100.1.2            10.100.1.1            TCP      58     0 → 233 [ACK] Seq=1 Ack=8 Win=32768 Len=0

Frame 9: 58 bytes on wire (464 bits), 58 bytes captured (464 bits) on interface veth2-1, id 0
Ethernet II, Src: 82:4e:fe:dc:9b:f8 (82:4e:fe:dc:9b:f8), Dst: 7e:b1:e9:f1:5c:b1 (7e:b1:e9:f1:5c:b1)
Internet Protocol Version 4, Src: 10.100.1.2, Dst: 10.100.1.1
Transmission Control Protocol, Src Port: 0, Dst Port: 233, Seq: 1, Ack: 8, Len: 0

No.     Time           Source                Destination           Protocol Length Info
     10 130.850115789  10.100.1.2            10.100.1.1            TCP      65     0 → 233 [ACK] Seq=1 Ack=8 Win=32768 Len=7

Frame 10: 65 bytes on wire (520 bits), 65 bytes captured (520 bits) on interface veth2-1, id 0
Ethernet II, Src: 82:4e:fe:dc:9b:f8 (82:4e:fe:dc:9b:f8), Dst: 7e:b1:e9:f1:5c:b1 (7e:b1:e9:f1:5c:b1)
Internet Protocol Version 4, Src: 10.100.1.2, Dst: 10.100.1.1
Transmission Control Protocol, Src Port: 0, Dst Port: 233, Seq: 1, Ack: 8, Len: 7
Data (7 bytes)

0000  70 6b 75 73 6f 61 72                              pkusoar

No.     Time           Source                Destination           Protocol Length Info
     11 130.860331703  10.100.1.1            10.100.1.2            TCP      58     233 → 0 [ACK] Seq=8 Ack=8 Win=32768 Len=0

Frame 11: 58 bytes on wire (464 bits), 58 bytes captured (464 bits) on interface veth2-1, id 0
Ethernet II, Src: 7e:b1:e9:f1:5c:b1 (7e:b1:e9:f1:5c:b1), Dst: 82:4e:fe:dc:9b:f8 (82:4e:fe:dc:9b:f8)
Internet Protocol Version 4, Src: 10.100.1.1, Dst: 10.100.1.2
Transmission Control Protocol, Src Port: 233, Dst Port: 0, Seq: 8, Ack: 8, Len: 0

No.     Time           Source                Destination           Protocol Length Info
     12 166.325359145  10.100.1.2            10.100.1.1            TCP      68     0 → 233 [ACK] Seq=8 Ack=8 Win=32768 Len=10

Frame 12: 68 bytes on wire (544 bits), 68 bytes captured (544 bits) on interface veth2-1, id 0
Ethernet II, Src: 82:4e:fe:dc:9b:f8 (82:4e:fe:dc:9b:f8), Dst: 7e:b1:e9:f1:5c:b1 (7e:b1:e9:f1:5c:b1)
Internet Protocol Version 4, Src: 10.100.1.2, Dst: 10.100.1.1
Transmission Control Protocol, Src Port: 0, Dst Port: 233, Seq: 8, Ack: 8, Len: 10
Data (10 bytes)

0000  71 77 65 72 74 79 75 69 6f 70                     qwertyuiop

No.     Time           Source                Destination           Protocol Length Info
     13 166.330079109  10.100.1.1            10.100.1.2            TCP      58     233 → 0 [ACK] Seq=8 Ack=18 Win=32768 Len=0

Frame 13: 58 bytes on wire (464 bits), 58 bytes captured (464 bits) on interface veth2-1, id 0
Ethernet II, Src: 7e:b1:e9:f1:5c:b1 (7e:b1:e9:f1:5c:b1), Dst: 82:4e:fe:dc:9b:f8 (82:4e:fe:dc:9b:f8)
Internet Protocol Version 4, Src: 10.100.1.1, Dst: 10.100.1.2
Transmission Control Protocol, Src Port: 233, Dst Port: 0, Seq: 8, Ack: 18, Len: 0

No.     Time           Source                Destination           Protocol Length Info
     14 174.070633575  10.100.1.1            10.100.1.2            TCP      67     233 → 0 [ACK] Seq=8 Ack=18 Win=32768 Len=9

Frame 14: 67 bytes on wire (536 bits), 67 bytes captured (536 bits) on interface veth2-1, id 0
Ethernet II, Src: 7e:b1:e9:f1:5c:b1 (7e:b1:e9:f1:5c:b1), Dst: 82:4e:fe:dc:9b:f8 (82:4e:fe:dc:9b:f8)
Internet Protocol Version 4, Src: 10.100.1.1, Dst: 10.100.1.2
Transmission Control Protocol, Src Port: 233, Dst Port: 0, Seq: 8, Ack: 18, Len: 9
Data (9 bytes)

0000  61 73 64 66 67 68 6a 6b 6c                        asdfghjkl

No.     Time           Source                Destination           Protocol Length Info
     15 174.083841101  10.100.1.2            10.100.1.1            TCP      58     0 → 233 [ACK] Seq=18 Ack=17 Win=32768 Len=0

Frame 15: 58 bytes on wire (464 bits), 58 bytes captured (464 bits) on interface veth2-1, id 0
Ethernet II, Src: 82:4e:fe:dc:9b:f8 (82:4e:fe:dc:9b:f8), Dst: 7e:b1:e9:f1:5c:b1 (7e:b1:e9:f1:5c:b1)
Internet Protocol Version 4, Src: 10.100.1.2, Dst: 10.100.1.1
Transmission Control Protocol, Src Port: 0, Dst Port: 233, Seq: 18, Ack: 17, Len: 0

No.     Time           Source                Destination           Protocol Length Info
     16 189.672534676  10.100.1.1            10.100.1.2            TCP      68     233 → 0 [ACK] Seq=17 Ack=18 Win=32768 Len=10

Frame 16: 68 bytes on wire (544 bits), 68 bytes captured (544 bits) on interface veth2-1, id 0
Ethernet II, Src: 7e:b1:e9:f1:5c:b1 (7e:b1:e9:f1:5c:b1), Dst: 82:4e:fe:dc:9b:f8 (82:4e:fe:dc:9b:f8)
Internet Protocol Version 4, Src: 10.100.1.1, Dst: 10.100.1.2
Transmission Control Protocol, Src Port: 233, Dst Port: 0, Seq: 17, Ack: 18, Len: 10
Data (10 bytes)

0000  31 32 33 34 35 36 37 38 39 30                     1234567890

No.     Time           Source                Destination           Protocol Length Info
     17 189.791708949  10.100.1.1            10.100.1.2            TCP      68     [TCP Retransmission] 233 → 0 [ACK] Seq=17 Ack=18 Win=32768 Len=10

Frame 17: 68 bytes on wire (544 bits), 68 bytes captured (544 bits) on interface veth2-1, id 0
Ethernet II, Src: 7e:b1:e9:f1:5c:b1 (7e:b1:e9:f1:5c:b1), Dst: 82:4e:fe:dc:9b:f8 (82:4e:fe:dc:9b:f8)
Internet Protocol Version 4, Src: 10.100.1.1, Dst: 10.100.1.2
Transmission Control Protocol, Src Port: 233, Dst Port: 0, Seq: 17, Ack: 18, Len: 10

No.     Time           Source                Destination           Protocol Length Info
     18 189.796105693  10.100.1.2            10.100.1.1            TCP      58     0 → 233 [ACK] Seq=18 Ack=27 Win=32768 Len=0

Frame 18: 58 bytes on wire (464 bits), 58 bytes captured (464 bits) on interface veth2-1, id 0
Ethernet II, Src: 82:4e:fe:dc:9b:f8 (82:4e:fe:dc:9b:f8), Dst: 7e:b1:e9:f1:5c:b1 (7e:b1:e9:f1:5c:b1)
Internet Protocol Version 4, Src: 10.100.1.2, Dst: 10.100.1.1
Transmission Control Protocol, Src Port: 0, Dst Port: 233, Seq: 18, Ack: 27, Len: 0

No.     Time           Source                Destination           Protocol Length Info
     19 204.812767408  10.100.1.1            10.100.1.2            TCP      68     233 → 0 [ACK] Seq=27 Ack=18 Win=32768 Len=10

Frame 19: 68 bytes on wire (544 bits), 68 bytes captured (544 bits) on interface veth2-1, id 0
Ethernet II, Src: 7e:b1:e9:f1:5c:b1 (7e:b1:e9:f1:5c:b1), Dst: 82:4e:fe:dc:9b:f8 (82:4e:fe:dc:9b:f8)
Internet Protocol Version 4, Src: 10.100.1.1, Dst: 10.100.1.2
Transmission Control Protocol, Src Port: 233, Dst Port: 0, Seq: 27, Ack: 18, Len: 10
Data (10 bytes)

0000  21 40 23 24 25 5e 26 2a 28 29                     !@#$%^&*()

No.     Time           Source                Destination           Protocol Length Info
     20 204.827559337  10.100.1.2            10.100.1.1            TCP      58     0 → 233 [ACK] Seq=18 Ack=37 Win=32768 Len=0

Frame 20: 58 bytes on wire (464 bits), 58 bytes captured (464 bits) on interface veth2-1, id 0
Ethernet II, Src: 82:4e:fe:dc:9b:f8 (82:4e:fe:dc:9b:f8), Dst: 7e:b1:e9:f1:5c:b1 (7e:b1:e9:f1:5c:b1)
Internet Protocol Version 4, Src: 10.100.1.2, Dst: 10.100.1.1
Transmission Control Protocol, Src Port: 0, Dst Port: 233, Seq: 18, Ack: 37, Len: 0

No.     Time           Source                Destination           Protocol Length Info
     21 212.865179443  10.100.1.1            10.100.1.2            TCP      68     233 → 0 [ACK] Seq=37 Ack=18 Win=32768 Len=10

Frame 21: 68 bytes on wire (544 bits), 68 bytes captured (544 bits) on interface veth2-1, id 0
Ethernet II, Src: 7e:b1:e9:f1:5c:b1 (7e:b1:e9:f1:5c:b1), Dst: 82:4e:fe:dc:9b:f8 (82:4e:fe:dc:9b:f8)
Internet Protocol Version 4, Src: 10.100.1.1, Dst: 10.100.1.2
Transmission Control Protocol, Src Port: 233, Dst Port: 0, Seq: 37, Ack: 18, Len: 10
Data (10 bytes)

0000  5f 2b 7b 7d 7c 3a 22 3c 3e 3f                     _+{}|:"<>?

No.     Time           Source                Destination           Protocol Length Info
     22 212.872335820  10.100.1.2            10.100.1.1            TCP      58     0 → 233 [ACK] Seq=18 Ack=47 Win=32768 Len=0

Frame 22: 58 bytes on wire (464 bits), 58 bytes captured (464 bits) on interface veth2-1, id 0
Ethernet II, Src: 82:4e:fe:dc:9b:f8 (82:4e:fe:dc:9b:f8), Dst: 7e:b1:e9:f1:5c:b1 (7e:b1:e9:f1:5c:b1)
Internet Protocol Version 4, Src: 10.100.1.2, Dst: 10.100.1.1
Transmission Control Protocol, Src Port: 0, Dst Port: 233, Seq: 18, Ack: 47, Len: 0

No.     Time           Source                Destination           Protocol Length Info
     23 224.971360455  10.100.1.1            10.100.1.2            TCP      68     233 → 0 [ACK] Seq=47 Ack=18 Win=32768 Len=10[Malformed Packet]

Frame 23: 68 bytes on wire (544 bits), 68 bytes captured (544 bits) on interface veth2-1, id 0
Ethernet II, Src: 7e:b1:e9:f1:5c:b1 (7e:b1:e9:f1:5c:b1), Dst: 82:4e:fe:dc:9b:f8 (82:4e:fe:dc:9b:f8)
Internet Protocol Version 4, Src: 10.100.1.1, Dst: 10.100.1.2
Transmission Control Protocol, Src Port: 233, Dst Port: 0, Seq: 47, Ack: 18, Len: 10
[Malformed Packet: LBMSRS]

No.     Time           Source                Destination           Protocol Length Info
     24 225.095158293  10.100.1.1            10.100.1.2            TCP      68     [TCP Retransmission] 233 → 0 [ACK] Seq=47 Ack=18 Win=32768 Len=10

Frame 24: 68 bytes on wire (544 bits), 68 bytes captured (544 bits) on interface veth2-1, id 0
Ethernet II, Src: 7e:b1:e9:f1:5c:b1 (7e:b1:e9:f1:5c:b1), Dst: 82:4e:fe:dc:9b:f8 (82:4e:fe:dc:9b:f8)
Internet Protocol Version 4, Src: 10.100.1.1, Dst: 10.100.1.2
Transmission Control Protocol, Src Port: 233, Dst Port: 0, Seq: 47, Ack: 18, Len: 10

No.     Time           Source                Destination           Protocol Length Info
     25 225.195197161  10.100.1.1            10.100.1.2            TCP      68     [TCP Retransmission] 233 → 0 [ACK] Seq=47 Ack=18 Win=32768 Len=10

Frame 25: 68 bytes on wire (544 bits), 68 bytes captured (544 bits) on interface veth2-1, id 0
Ethernet II, Src: 7e:b1:e9:f1:5c:b1 (7e:b1:e9:f1:5c:b1), Dst: 82:4e:fe:dc:9b:f8 (82:4e:fe:dc:9b:f8)
Internet Protocol Version 4, Src: 10.100.1.1, Dst: 10.100.1.2
Transmission Control Protocol, Src Port: 233, Dst Port: 0, Seq: 47, Ack: 18, Len: 10

No.     Time           Source                Destination           Protocol Length Info
     26 225.295339422  10.100.1.1            10.100.1.2            TCP      68     [TCP Retransmission] 233 → 0 [ACK] Seq=47 Ack=18 Win=32768 Len=10

Frame 26: 68 bytes on wire (544 bits), 68 bytes captured (544 bits) on interface veth2-1, id 0
Ethernet II, Src: 7e:b1:e9:f1:5c:b1 (7e:b1:e9:f1:5c:b1), Dst: 82:4e:fe:dc:9b:f8 (82:4e:fe:dc:9b:f8)
Internet Protocol Version 4, Src: 10.100.1.1, Dst: 10.100.1.2
Transmission Control Protocol, Src Port: 233, Dst Port: 0, Seq: 47, Ack: 18, Len: 10

No.     Time           Source                Destination           Protocol Length Info
     27 225.303729322  10.100.1.2            10.100.1.1            TCP      58     0 → 233 [ACK] Seq=18 Ack=57 Win=32768 Len=0

Frame 27: 58 bytes on wire (464 bits), 58 bytes captured (464 bits) on interface veth2-1, id 0
Ethernet II, Src: 82:4e:fe:dc:9b:f8 (82:4e:fe:dc:9b:f8), Dst: 7e:b1:e9:f1:5c:b1 (7e:b1:e9:f1:5c:b1)
Internet Protocol Version 4, Src: 10.100.1.2, Dst: 10.100.1.1
Transmission Control Protocol, Src Port: 0, Dst Port: 233, Seq: 18, Ack: 57, Len: 0

No.     Time           Source                Destination           Protocol Length Info
     28 244.102150020  10.100.1.1            10.100.1.2            TCP      84     233 → 0 [ACK] Seq=57 Ack=18 Win=32768 Len=26

Frame 28: 84 bytes on wire (672 bits), 84 bytes captured (672 bits) on interface veth2-1, id 0
Ethernet II, Src: 7e:b1:e9:f1:5c:b1 (7e:b1:e9:f1:5c:b1), Dst: 82:4e:fe:dc:9b:f8 (82:4e:fe:dc:9b:f8)
Internet Protocol Version 4, Src: 10.100.1.1, Dst: 10.100.1.2
Transmission Control Protocol, Src Port: 233, Dst Port: 0, Seq: 57, Ack: 18, Len: 26
Data (26 bytes)

0000  71 61 7a 77 73 78 65 64 63 72 66 76 74 67 62 79   qazwsxedcrfvtgby
0010  68 6e 75 6a 6d 69 6b 6f 6c 70                     hnujmikolp

No.     Time           Source                Destination           Protocol Length Info
     29 244.119399130  10.100.1.2            10.100.1.1            TCP      58     0 → 233 [ACK] Seq=18 Ack=83 Win=32768 Len=0

Frame 29: 58 bytes on wire (464 bits), 58 bytes captured (464 bits) on interface veth2-1, id 0
Ethernet II, Src: 82:4e:fe:dc:9b:f8 (82:4e:fe:dc:9b:f8), Dst: 7e:b1:e9:f1:5c:b1 (7e:b1:e9:f1:5c:b1)
Internet Protocol Version 4, Src: 10.100.1.2, Dst: 10.100.1.1
Transmission Control Protocol, Src Port: 0, Dst Port: 233, Seq: 18, Ack: 83, Len: 0

No.     Time           Source                Destination           Protocol Length Info
     30 245.759249913  fe80::7cb1:e9ff:fef1:5cb1 ff02::2               ICMPv6   70     Router Solicitation from 7e:b1:e9:f1:5c:b1

Frame 30: 70 bytes on wire (560 bits), 70 bytes captured (560 bits) on interface veth2-1, id 0
Ethernet II, Src: 7e:b1:e9:f1:5c:b1 (7e:b1:e9:f1:5c:b1), Dst: IPv6mcast_02 (33:33:00:00:00:02)
Internet Protocol Version 6, Src: fe80::7cb1:e9ff:fef1:5cb1, Dst: ff02::2
Internet Control Message Protocol v6

No.     Time           Source                Destination           Protocol Length Info
     31 256.338588491  10.100.1.1            10.100.1.2            TCP      68     233 → 0 [ACK] Seq=83 Ack=18 Win=32768 Len=10

Frame 31: 68 bytes on wire (544 bits), 68 bytes captured (544 bits) on interface veth2-1, id 0
Ethernet II, Src: 7e:b1:e9:f1:5c:b1 (7e:b1:e9:f1:5c:b1), Dst: 82:4e:fe:dc:9b:f8 (82:4e:fe:dc:9b:f8)
Internet Protocol Version 4, Src: 10.100.1.1, Dst: 10.100.1.2
Transmission Control Protocol, Src Port: 233, Dst Port: 0, Seq: 83, Ack: 18, Len: 10
Data (10 bytes)

0000  29 28 2a 26 5e 25 24 23 40 21                     )(*&^%$#@!

No.     Time           Source                Destination           Protocol Length Info
     32 256.350197236  10.100.1.2            10.100.1.1            TCP      58     0 → 233 [ACK] Seq=18 Ack=93 Win=32768 Len=0

Frame 32: 58 bytes on wire (464 bits), 58 bytes captured (464 bits) on interface veth2-1, id 0
Ethernet II, Src: 82:4e:fe:dc:9b:f8 (82:4e:fe:dc:9b:f8), Dst: 7e:b1:e9:f1:5c:b1 (7e:b1:e9:f1:5c:b1)
Internet Protocol Version 4, Src: 10.100.1.2, Dst: 10.100.1.1
Transmission Control Protocol, Src Port: 0, Dst Port: 233, Seq: 18, Ack: 93, Len: 0

No.     Time           Source                Destination           Protocol Length Info
     33 311.295199035  fe80::804e:feff:fedc:9bf8 ff02::2               ICMPv6   70     Router Solicitation from 82:4e:fe:dc:9b:f8

Frame 33: 70 bytes on wire (560 bits), 70 bytes captured (560 bits) on interface veth2-1, id 0
Ethernet II, Src: 82:4e:fe:dc:9b:f8 (82:4e:fe:dc:9b:f8), Dst: IPv6mcast_02 (33:33:00:00:00:02)
Internet Protocol Version 6, Src: fe80::804e:feff:fedc:9bf8, Dst: ff02::2
Internet Control Message Protocol v6
