No.     Time           Source                Destination           Protocol Length Info
      1 0.000000000    de:97:b9:90:bd:04     Broadcast             ARP      46     Who has 12.0.0.0? Tell 189.4.10.100

Frame 1: 46 bytes on wire (368 bits), 46 bytes captured (368 bits) on interface veth3-2, id 0
Ethernet II, Src: de:97:b9:90:bd:04 (de:97:b9:90:bd:04), Dst: Broadcast (ff:ff:ff:ff:ff:ff)
Address Resolution Protocol (request)

No.     Time           Source                Destination           Protocol Length Info
      2 0.011796676    06:1b:35:1c:44:a0     Broadcast             ARP      46     Who has 12.0.0.0? Tell 189.4.10.100 (duplicate use of 189.4.10.100 detected!)

Frame 2: 46 bytes on wire (368 bits), 46 bytes captured (368 bits) on interface veth3-2, id 0
Ethernet II, Src: 06:1b:35:1c:44:a0 (06:1b:35:1c:44:a0), Dst: Broadcast (ff:ff:ff:ff:ff:ff)
Address Resolution Protocol (request)
[Duplicate IP address detected for 189.4.10.100 (00:02:de:97:b9:90) - also in use by 00:01:de:97:b9:90 (frame 1)]

No.     Time           Source                Destination           Protocol Length Info
      3 0.031746842    de:97:b9:90:bd:04     Broadcast             ARP      46     Who has 12.0.0.0? Tell 189.4.10.100 (duplicate use of 189.4.10.100 detected!)

Frame 3: 46 bytes on wire (368 bits), 46 bytes captured (368 bits) on interface veth3-2, id 0
Ethernet II, Src: de:97:b9:90:bd:04 (de:97:b9:90:bd:04), Dst: Broadcast (ff:ff:ff:ff:ff:ff)
Address Resolution Protocol (request)
[Duplicate IP address detected for 189.4.10.100 (00:03:de:97:b9:90) - also in use by 00:01:de:97:b9:90 (frame 1)]

No.     Time           Source                Destination           Protocol Length Info
      4 0.043722991    06:1b:35:1c:44:a0     de:97:b9:90:bd:04     ARP      46     92.177.10.100 is at 00:02:7e:b1:e9:f1

Frame 4: 46 bytes on wire (368 bits), 46 bytes captured (368 bits) on interface veth3-2, id 0
Ethernet II, Src: 06:1b:35:1c:44:a0 (06:1b:35:1c:44:a0), Dst: de:97:b9:90:bd:04 (de:97:b9:90:bd:04)
Address Resolution Protocol (reply)

No.     Time           Source                Destination           Protocol Length Info
      5 0.043820155    06:1b:35:1c:44:a0     de:97:b9:90:bd:04     ARP      46     92.177.10.100 is at 00:02:7e:b1:e9:f1

Frame 5: 46 bytes on wire (368 bits), 46 bytes captured (368 bits) on interface veth3-2, id 0
Ethernet II, Src: 06:1b:35:1c:44:a0 (06:1b:35:1c:44:a0), Dst: de:97:b9:90:bd:04 (de:97:b9:90:bd:04)
Address Resolution Protocol (reply)

No.     Time           Source                Destination           Protocol Length Info
      6 0.050961036    10.100.2.2            10.100.1.1            TCP      58     0 → 233 [SYN] Seq=0 Win=32768 Len=0

Frame 6: 58 bytes on wire (464 bits), 58 bytes captured (464 bits) on interface veth3-2, id 0
Ethernet II, Src: de:97:b9:90:bd:04 (de:97:b9:90:bd:04), Dst: 06:1b:35:1c:44:a0 (06:1b:35:1c:44:a0)
Internet Protocol Version 4, Src: 10.100.2.2, Dst: 10.100.1.1
Transmission Control Protocol, Src Port: 0, Dst Port: 233, Seq: 0, Len: 0

No.     Time           Source                Destination           Protocol Length Info
      7 7.231517504    10.100.1.1            10.100.2.2            TCP      58     233 → 0 [SYN, ACK] Seq=0 Ack=1 Win=32768 Len=0

Frame 7: 58 bytes on wire (464 bits), 58 bytes captured (464 bits) on interface veth3-2, id 0
Ethernet II, Src: 06:1b:35:1c:44:a0 (06:1b:35:1c:44:a0), Dst: de:97:b9:90:bd:04 (de:97:b9:90:bd:04)
Internet Protocol Version 4, Src: 10.100.1.1, Dst: 10.100.2.2
Transmission Control Protocol, Src Port: 233, Dst Port: 0, Seq: 0, Ack: 1, Len: 0

No.     Time           Source                Destination           Protocol Length Info
      8 7.260892759    10.100.2.2            10.100.1.1            TCP      58     0 → 233 [ACK] Seq=1 Ack=1 Win=32768 Len=0

Frame 8: 58 bytes on wire (464 bits), 58 bytes captured (464 bits) on interface veth3-2, id 0
Ethernet II, Src: de:97:b9:90:bd:04 (de:97:b9:90:bd:04), Dst: 06:1b:35:1c:44:a0 (06:1b:35:1c:44:a0)
Internet Protocol Version 4, Src: 10.100.2.2, Dst: 10.100.1.1
Transmission Control Protocol, Src Port: 0, Dst Port: 233, Seq: 1, Ack: 1, Len: 0

No.     Time           Source                Destination           Protocol Length Info
      9 45.306739616   10.100.2.2            10.100.1.1            TCP      68     0 → 233 [ACK] Seq=1 Ack=1 Win=32768 Len=10

Frame 9: 68 bytes on wire (544 bits), 68 bytes captured (544 bits) on interface veth3-2, id 0
Ethernet II, Src: de:97:b9:90:bd:04 (de:97:b9:90:bd:04), Dst: 06:1b:35:1c:44:a0 (06:1b:35:1c:44:a0)
Internet Protocol Version 4, Src: 10.100.2.2, Dst: 10.100.1.1
Transmission Control Protocol, Src Port: 0, Dst Port: 233, Seq: 1, Ack: 1, Len: 10
Data (10 bytes)

0000  71 77 65 72 74 79 75 69 6f 70                     qwertyuiop

No.     Time           Source                Destination           Protocol Length Info
     10 45.452453755   10.100.2.2            10.100.1.1            TCP      68     [TCP Retransmission] 0 → 233 [ACK] Seq=1 Ack=1 Win=32768 Len=10

Frame 10: 68 bytes on wire (544 bits), 68 bytes captured (544 bits) on interface veth3-2, id 0
Ethernet II, Src: de:97:b9:90:bd:04 (de:97:b9:90:bd:04), Dst: 06:1b:35:1c:44:a0 (06:1b:35:1c:44:a0)
Internet Protocol Version 4, Src: 10.100.2.2, Dst: 10.100.1.1
Transmission Control Protocol, Src Port: 0, Dst Port: 233, Seq: 1, Ack: 1, Len: 10

No.     Time           Source                Destination           Protocol Length Info
     11 45.552584791   10.100.2.2            10.100.1.1            TCP      68     [TCP Retransmission] 0 → 233 [ACK] Seq=1 Ack=1 Win=32768 Len=10

Frame 11: 68 bytes on wire (544 bits), 68 bytes captured (544 bits) on interface veth3-2, id 0
Ethernet II, Src: de:97:b9:90:bd:04 (de:97:b9:90:bd:04), Dst: 06:1b:35:1c:44:a0 (06:1b:35:1c:44:a0)
Internet Protocol Version 4, Src: 10.100.2.2, Dst: 10.100.1.1
Transmission Control Protocol, Src Port: 0, Dst Port: 233, Seq: 1, Ack: 1, Len: 10

No.     Time           Source                Destination           Protocol Length Info
     12 45.652712722   10.100.2.2            10.100.1.1            TCP      68     [TCP Retransmission] 0 → 233 [ACK] Seq=1 Ack=1 Win=32768 Len=10

Frame 12: 68 bytes on wire (544 bits), 68 bytes captured (544 bits) on interface veth3-2, id 0
Ethernet II, Src: de:97:b9:90:bd:04 (de:97:b9:90:bd:04), Dst: 06:1b:35:1c:44:a0 (06:1b:35:1c:44:a0)
Internet Protocol Version 4, Src: 10.100.2.2, Dst: 10.100.1.1
Transmission Control Protocol, Src Port: 0, Dst Port: 233, Seq: 1, Ack: 1, Len: 10

No.     Time           Source                Destination           Protocol Length Info
     13 45.679200666   10.100.1.1            10.100.2.2            TCP      58     233 → 0 [ACK] Seq=1 Ack=11 Win=32768 Len=0

Frame 13: 58 bytes on wire (464 bits), 58 bytes captured (464 bits) on interface veth3-2, id 0
Ethernet II, Src: 06:1b:35:1c:44:a0 (06:1b:35:1c:44:a0), Dst: de:97:b9:90:bd:04 (de:97:b9:90:bd:04)
Internet Protocol Version 4, Src: 10.100.1.1, Dst: 10.100.2.2
Transmission Control Protocol, Src Port: 233, Dst Port: 0, Seq: 1, Ack: 11, Len: 0

No.     Time           Source                Destination           Protocol Length Info
     14 51.476019121   10.100.2.2            10.100.1.1            TCP      68     0 → 233 [ACK] Seq=11 Ack=1 Win=32768 Len=10

Frame 14: 68 bytes on wire (544 bits), 68 bytes captured (544 bits) on interface veth3-2, id 0
Ethernet II, Src: de:97:b9:90:bd:04 (de:97:b9:90:bd:04), Dst: 06:1b:35:1c:44:a0 (06:1b:35:1c:44:a0)
Internet Protocol Version 4, Src: 10.100.2.2, Dst: 10.100.1.1
Transmission Control Protocol, Src Port: 0, Dst Port: 233, Seq: 11, Ack: 1, Len: 10
Data (10 bytes)

0000  31 32 33 34 35 36 37 38 39 30                     1234567890

No.     Time           Source                Destination           Protocol Length Info
     15 51.653724306   10.100.2.2            10.100.1.1            TCP      68     [TCP Retransmission] 0 → 233 [ACK] Seq=11 Ack=1 Win=32768 Len=10

Frame 15: 68 bytes on wire (544 bits), 68 bytes captured (544 bits) on interface veth3-2, id 0
Ethernet II, Src: de:97:b9:90:bd:04 (de:97:b9:90:bd:04), Dst: 06:1b:35:1c:44:a0 (06:1b:35:1c:44:a0)
Internet Protocol Version 4, Src: 10.100.2.2, Dst: 10.100.1.1
Transmission Control Protocol, Src Port: 0, Dst Port: 233, Seq: 11, Ack: 1, Len: 10

No.     Time           Source                Destination           Protocol Length Info
     16 51.753906529   10.100.2.2            10.100.1.1            TCP      68     [TCP Retransmission] 0 → 233 [ACK] Seq=11 Ack=1 Win=32768 Len=10

Frame 16: 68 bytes on wire (544 bits), 68 bytes captured (544 bits) on interface veth3-2, id 0
Ethernet II, Src: de:97:b9:90:bd:04 (de:97:b9:90:bd:04), Dst: 06:1b:35:1c:44:a0 (06:1b:35:1c:44:a0)
Internet Protocol Version 4, Src: 10.100.2.2, Dst: 10.100.1.1
Transmission Control Protocol, Src Port: 0, Dst Port: 233, Seq: 11, Ack: 1, Len: 10

No.     Time           Source                Destination           Protocol Length Info
     17 51.854139332   10.100.2.2            10.100.1.1            TCP      68     [TCP Retransmission] 0 → 233 [ACK] Seq=11 Ack=1 Win=32768 Len=10

Frame 17: 68 bytes on wire (544 bits), 68 bytes captured (544 bits) on interface veth3-2, id 0
Ethernet II, Src: de:97:b9:90:bd:04 (de:97:b9:90:bd:04), Dst: 06:1b:35:1c:44:a0 (06:1b:35:1c:44:a0)
Internet Protocol Version 4, Src: 10.100.2.2, Dst: 10.100.1.1
Transmission Control Protocol, Src Port: 0, Dst Port: 233, Seq: 11, Ack: 1, Len: 10

No.     Time           Source                Destination           Protocol Length Info
     18 51.899626426   10.100.1.1            10.100.2.2            TCP      58     233 → 0 [ACK] Seq=1 Ack=21 Win=32768 Len=0

Frame 18: 58 bytes on wire (464 bits), 58 bytes captured (464 bits) on interface veth3-2, id 0
Ethernet II, Src: 06:1b:35:1c:44:a0 (06:1b:35:1c:44:a0), Dst: de:97:b9:90:bd:04 (de:97:b9:90:bd:04)
Internet Protocol Version 4, Src: 10.100.1.1, Dst: 10.100.2.2
Transmission Control Protocol, Src Port: 233, Dst Port: 0, Seq: 1, Ack: 21, Len: 0

No.     Time           Source                Destination           Protocol Length Info
     19 55.666154119   10.100.2.2            10.100.1.1            TCP      68     0 → 233 [ACK] Seq=21 Ack=1 Win=32768 Len=10

Frame 19: 68 bytes on wire (544 bits), 68 bytes captured (544 bits) on interface veth3-2, id 0
Ethernet II, Src: de:97:b9:90:bd:04 (de:97:b9:90:bd:04), Dst: 06:1b:35:1c:44:a0 (06:1b:35:1c:44:a0)
Internet Protocol Version 4, Src: 10.100.2.2, Dst: 10.100.1.1
Transmission Control Protocol, Src Port: 0, Dst Port: 233, Seq: 21, Ack: 1, Len: 10
Data (10 bytes)

0000  21 40 23 24 25 5e 26 2a 28 29                     !@#$%^&*()

No.     Time           Source                Destination           Protocol Length Info
     20 55.695530973   10.100.1.1            10.100.2.2            TCP      58     233 → 0 [ACK] Seq=1 Ack=31 Win=32768 Len=0

Frame 20: 58 bytes on wire (464 bits), 58 bytes captured (464 bits) on interface veth3-2, id 0
Ethernet II, Src: 06:1b:35:1c:44:a0 (06:1b:35:1c:44:a0), Dst: de:97:b9:90:bd:04 (de:97:b9:90:bd:04)
Internet Protocol Version 4, Src: 10.100.1.1, Dst: 10.100.2.2
Transmission Control Protocol, Src Port: 233, Dst Port: 0, Seq: 1, Ack: 31, Len: 0

No.     Time           Source                Destination           Protocol Length Info
     21 68.900036800   10.100.2.2            10.100.1.1            TCP      68     0 → 233 [ACK] Seq=31 Ack=1 Win=32768 Len=10

Frame 21: 68 bytes on wire (544 bits), 68 bytes captured (544 bits) on interface veth3-2, id 0
Ethernet II, Src: de:97:b9:90:bd:04 (de:97:b9:90:bd:04), Dst: 06:1b:35:1c:44:a0 (06:1b:35:1c:44:a0)
Internet Protocol Version 4, Src: 10.100.2.2, Dst: 10.100.1.1
Transmission Control Protocol, Src Port: 0, Dst Port: 233, Seq: 31, Ack: 1, Len: 10
Data (10 bytes)

0000  41 53 44 46 47 48 4a 4b 4c 3a                     ASDFGHJKL:

No.     Time           Source                Destination           Protocol Length Info
     22 69.058128329   10.100.2.2            10.100.1.1            TCP      68     [TCP Retransmission] 0 → 233 [ACK] Seq=31 Ack=1 Win=32768 Len=10

Frame 22: 68 bytes on wire (544 bits), 68 bytes captured (544 bits) on interface veth3-2, id 0
Ethernet II, Src: de:97:b9:90:bd:04 (de:97:b9:90:bd:04), Dst: 06:1b:35:1c:44:a0 (06:1b:35:1c:44:a0)
Internet Protocol Version 4, Src: 10.100.2.2, Dst: 10.100.1.1
Transmission Control Protocol, Src Port: 0, Dst Port: 233, Seq: 31, Ack: 1, Len: 10

No.     Time           Source                Destination           Protocol Length Info
     23 69.158272630   10.100.2.2            10.100.1.1            TCP      68     [TCP Retransmission] 0 → 233 [ACK] Seq=31 Ack=1 Win=32768 Len=10

Frame 23: 68 bytes on wire (544 bits), 68 bytes captured (544 bits) on interface veth3-2, id 0
Ethernet II, Src: de:97:b9:90:bd:04 (de:97:b9:90:bd:04), Dst: 06:1b:35:1c:44:a0 (06:1b:35:1c:44:a0)
Internet Protocol Version 4, Src: 10.100.2.2, Dst: 10.100.1.1
Transmission Control Protocol, Src Port: 0, Dst Port: 233, Seq: 31, Ack: 1, Len: 10

No.     Time           Source                Destination           Protocol Length Info
     24 69.191647663   10.100.1.1            10.100.2.2            TCP      58     233 → 0 [ACK] Seq=1 Ack=41 Win=32768 Len=0

Frame 24: 58 bytes on wire (464 bits), 58 bytes captured (464 bits) on interface veth3-2, id 0
Ethernet II, Src: 06:1b:35:1c:44:a0 (06:1b:35:1c:44:a0), Dst: de:97:b9:90:bd:04 (de:97:b9:90:bd:04)
Internet Protocol Version 4, Src: 10.100.1.1, Dst: 10.100.2.2
Transmission Control Protocol, Src Port: 233, Dst Port: 0, Seq: 1, Ack: 41, Len: 0

No.     Time           Source                Destination           Protocol Length Info
     25 73.497679336   10.100.2.2            10.100.1.1            TCP      68     0 → 233 [ACK] Seq=41 Ack=1 Win=32768 Len=10[Malformed Packet]

Frame 25: 68 bytes on wire (544 bits), 68 bytes captured (544 bits) on interface veth3-2, id 0
Ethernet II, Src: de:97:b9:90:bd:04 (de:97:b9:90:bd:04), Dst: 06:1b:35:1c:44:a0 (06:1b:35:1c:44:a0)
Internet Protocol Version 4, Src: 10.100.2.2, Dst: 10.100.1.1
Transmission Control Protocol, Src Port: 0, Dst Port: 233, Seq: 41, Ack: 1, Len: 10
[Malformed Packet: LBMSRS]

No.     Time           Source                Destination           Protocol Length Info
     26 73.519139808   10.100.1.1            10.100.2.2            TCP      58     233 → 0 [ACK] Seq=1 Ack=51 Win=32768 Len=0

Frame 26: 58 bytes on wire (464 bits), 58 bytes captured (464 bits) on interface veth3-2, id 0
Ethernet II, Src: 06:1b:35:1c:44:a0 (06:1b:35:1c:44:a0), Dst: de:97:b9:90:bd:04 (de:97:b9:90:bd:04)
Internet Protocol Version 4, Src: 10.100.1.1, Dst: 10.100.2.2
Transmission Control Protocol, Src Port: 233, Dst Port: 0, Seq: 1, Ack: 51, Len: 0

No.     Time           Source                Destination           Protocol Length Info
     27 78.605968393   10.100.2.2            10.100.1.1            TCP      68     0 → 233 [ACK] Seq=51 Ack=1 Win=32768 Len=10

Frame 27: 68 bytes on wire (544 bits), 68 bytes captured (544 bits) on interface veth3-2, id 0
Ethernet II, Src: de:97:b9:90:bd:04 (de:97:b9:90:bd:04), Dst: 06:1b:35:1c:44:a0 (06:1b:35:1c:44:a0)
Internet Protocol Version 4, Src: 10.100.2.2, Dst: 10.100.1.1
Transmission Control Protocol, Src Port: 0, Dst Port: 233, Seq: 51, Ack: 1, Len: 10
Data (10 bytes)

0000  5f 2b 7b 7d 7c 3a 22 3c 3e 3f                     _+{}|:"<>?

No.     Time           Source                Destination           Protocol Length Info
     28 78.635390381   10.100.1.1            10.100.2.2            TCP      58     233 → 0 [ACK] Seq=1 Ack=61 Win=32768 Len=0

Frame 28: 58 bytes on wire (464 bits), 58 bytes captured (464 bits) on interface veth3-2, id 0
Ethernet II, Src: 06:1b:35:1c:44:a0 (06:1b:35:1c:44:a0), Dst: de:97:b9:90:bd:04 (de:97:b9:90:bd:04)
Internet Protocol Version 4, Src: 10.100.1.1, Dst: 10.100.2.2
Transmission Control Protocol, Src Port: 233, Dst Port: 0, Seq: 1, Ack: 61, Len: 0
