No.     Time           Source                Destination           Protocol Length Info
      1 0.000000000    3a:9e:db:aa:2e:df     Broadcast             ARP      46     Who has 12.0.0.0? Tell 46.223.10.100

Frame 1: 46 bytes on wire (368 bits), 46 bytes captured (368 bits) on interface veth1-2, id 0
Ethernet II, Src: 3a:9e:db:aa:2e:df (3a:9e:db:aa:2e:df), Dst: Broadcast (ff:ff:ff:ff:ff:ff)
Address Resolution Protocol (request)

No.     Time           Source                Destination           Protocol Length Info
      2 0.010550043    da:da:ef:3b:6a:ea     3a:9e:db:aa:2e:df     ARP      46     106.234.10.100 is at 00:01:da:da:ef:3b

Frame 2: 46 bytes on wire (368 bits), 46 bytes captured (368 bits) on interface veth1-2, id 0
Ethernet II, Src: da:da:ef:3b:6a:ea (da:da:ef:3b:6a:ea), Dst: 3a:9e:db:aa:2e:df (3a:9e:db:aa:2e:df)
Address Resolution Protocol (reply)

No.     Time           Source                Destination           Protocol Length Info
      3 0.029381315    10.100.1.2            10.100.1.1            TCP      58     0 → 233 [SYN] Seq=0 Win=32768 Len=0

Frame 3: 58 bytes on wire (464 bits), 58 bytes captured (464 bits) on interface veth1-2, id 0
Ethernet II, Src: 3a:9e:db:aa:2e:df (3a:9e:db:aa:2e:df), Dst: da:da:ef:3b:6a:ea (da:da:ef:3b:6a:ea)
Internet Protocol Version 4, Src: 10.100.1.2, Dst: 10.100.1.1
Transmission Control Protocol, Src Port: 0, Dst Port: 233, Seq: 0, Len: 0

No.     Time           Source                Destination           Protocol Length Info
      4 6.144609656    10.100.1.1            10.100.1.2            TCP      58     233 → 0 [SYN, ACK] Seq=0 Ack=1 Win=32768 Len=0

Frame 4: 58 bytes on wire (464 bits), 58 bytes captured (464 bits) on interface veth1-2, id 0
Ethernet II, Src: da:da:ef:3b:6a:ea (da:da:ef:3b:6a:ea), Dst: 3a:9e:db:aa:2e:df (3a:9e:db:aa:2e:df)
Internet Protocol Version 4, Src: 10.100.1.1, Dst: 10.100.1.2
Transmission Control Protocol, Src Port: 233, Dst Port: 0, Seq: 0, Ack: 1, Len: 0

No.     Time           Source                Destination           Protocol Length Info
      5 6.161283482    10.100.1.2            10.100.1.1            TCP      58     0 → 233 [ACK] Seq=1 Ack=1 Win=32768 Len=0

Frame 5: 58 bytes on wire (464 bits), 58 bytes captured (464 bits) on interface veth1-2, id 0
Ethernet II, Src: 3a:9e:db:aa:2e:df (3a:9e:db:aa:2e:df), Dst: da:da:ef:3b:6a:ea (da:da:ef:3b:6a:ea)
Internet Protocol Version 4, Src: 10.100.1.2, Dst: 10.100.1.1
Transmission Control Protocol, Src Port: 0, Dst Port: 233, Seq: 1, Ack: 1, Len: 0

No.     Time           Source                Destination           Protocol Length Info
      6 18.062264348   10.100.1.1            10.100.1.2            TCP      65     233 → 0 [ACK] Seq=1 Ack=1 Win=32768 Len=7

Frame 6: 65 bytes on wire (520 bits), 65 bytes captured (520 bits) on interface veth1-2, id 0
Ethernet II, Src: da:da:ef:3b:6a:ea (da:da:ef:3b:6a:ea), Dst: 3a:9e:db:aa:2e:df (3a:9e:db:aa:2e:df)
Internet Protocol Version 4, Src: 10.100.1.1, Dst: 10.100.1.2
Transmission Control Protocol, Src Port: 233, Dst Port: 0, Seq: 1, Ack: 1, Len: 7
Data (7 bytes)

0000  70 6b 75 65 65 63 73                              pkueecs

No.     Time           Source                Destination           Protocol Length Info
      7 18.070092321   10.100.1.2            10.100.1.1            TCP      58     0 → 233 [ACK] Seq=1 Ack=8 Win=32768 Len=0

Frame 7: 58 bytes on wire (464 bits), 58 bytes captured (464 bits) on interface veth1-2, id 0
Ethernet II, Src: 3a:9e:db:aa:2e:df (3a:9e:db:aa:2e:df), Dst: da:da:ef:3b:6a:ea (da:da:ef:3b:6a:ea)
Internet Protocol Version 4, Src: 10.100.1.2, Dst: 10.100.1.1
Transmission Control Protocol, Src Port: 0, Dst Port: 233, Seq: 1, Ack: 8, Len: 0

No.     Time           Source                Destination           Protocol Length Info
      8 23.147512803   10.100.1.2            10.100.1.1            TCP      65     0 → 233 [ACK] Seq=1 Ack=8 Win=32768 Len=7

Frame 8: 65 bytes on wire (520 bits), 65 bytes captured (520 bits) on interface veth1-2, id 0
Ethernet II, Src: 3a:9e:db:aa:2e:df (3a:9e:db:aa:2e:df), Dst: da:da:ef:3b:6a:ea (da:da:ef:3b:6a:ea)
Internet Protocol Version 4, Src: 10.100.1.2, Dst: 10.100.1.1
Transmission Control Protocol, Src Port: 0, Dst Port: 233, Seq: 1, Ack: 8, Len: 7
Data (7 bytes)

0000  70 6b 75 73 6f 61 72                              pkusoar

No.     Time           Source                Destination           Protocol Length Info
      9 23.150767810   10.100.1.1            10.100.1.2            TCP      58     233 → 0 [ACK] Seq=8 Ack=8 Win=32768 Len=0

Frame 9: 58 bytes on wire (464 bits), 58 bytes captured (464 bits) on interface veth1-2, id 0
Ethernet II, Src: da:da:ef:3b:6a:ea (da:da:ef:3b:6a:ea), Dst: 3a:9e:db:aa:2e:df (3a:9e:db:aa:2e:df)
Internet Protocol Version 4, Src: 10.100.1.1, Dst: 10.100.1.2
Transmission Control Protocol, Src Port: 233, Dst Port: 0, Seq: 8, Ack: 8, Len: 0

No.     Time           Source                Destination           Protocol Length Info
     10 42.892892891   10.100.1.1            10.100.1.2            TCP      68     233 → 0 [ACK] Seq=8 Ack=8 Win=32768 Len=10

Frame 10: 68 bytes on wire (544 bits), 68 bytes captured (544 bits) on interface veth1-2, id 0
Ethernet II, Src: da:da:ef:3b:6a:ea (da:da:ef:3b:6a:ea), Dst: 3a:9e:db:aa:2e:df (3a:9e:db:aa:2e:df)
Internet Protocol Version 4, Src: 10.100.1.1, Dst: 10.100.1.2
Transmission Control Protocol, Src Port: 233, Dst Port: 0, Seq: 8, Ack: 8, Len: 10
Data (10 bytes)

0000  51 57 45 52 54 59 55 49 4f 50                     QWERTYUIOP

No.     Time           Source                Destination           Protocol Length Info
     11 42.900974762   10.100.1.2            10.100.1.1            TCP      58     0 → 233 [ACK] Seq=8 Ack=18 Win=32768 Len=0

Frame 11: 58 bytes on wire (464 bits), 58 bytes captured (464 bits) on interface veth1-2, id 0
Ethernet II, Src: 3a:9e:db:aa:2e:df (3a:9e:db:aa:2e:df), Dst: da:da:ef:3b:6a:ea (da:da:ef:3b:6a:ea)
Internet Protocol Version 4, Src: 10.100.1.2, Dst: 10.100.1.1
Transmission Control Protocol, Src Port: 0, Dst Port: 233, Seq: 8, Ack: 18, Len: 0

No.     Time           Source                Destination           Protocol Length Info
     12 47.398403720   10.100.1.1            10.100.1.2            TCP      68     233 → 0 [ACK] Seq=18 Ack=8 Win=32768 Len=10

Frame 12: 68 bytes on wire (544 bits), 68 bytes captured (544 bits) on interface veth1-2, id 0
Ethernet II, Src: da:da:ef:3b:6a:ea (da:da:ef:3b:6a:ea), Dst: 3a:9e:db:aa:2e:df (3a:9e:db:aa:2e:df)
Internet Protocol Version 4, Src: 10.100.1.1, Dst: 10.100.1.2
Transmission Control Protocol, Src Port: 233, Dst Port: 0, Seq: 18, Ack: 8, Len: 10
Data (10 bytes)

0000  31 32 33 34 35 36 37 38 39 30                     1234567890

No.     Time           Source                Destination           Protocol Length Info
     13 47.418632522   10.100.1.2            10.100.1.1            TCP      58     0 → 233 [ACK] Seq=8 Ack=28 Win=32768 Len=0

Frame 13: 58 bytes on wire (464 bits), 58 bytes captured (464 bits) on interface veth1-2, id 0
Ethernet II, Src: 3a:9e:db:aa:2e:df (3a:9e:db:aa:2e:df), Dst: da:da:ef:3b:6a:ea (da:da:ef:3b:6a:ea)
Internet Protocol Version 4, Src: 10.100.1.2, Dst: 10.100.1.1
Transmission Control Protocol, Src Port: 0, Dst Port: 233, Seq: 8, Ack: 28, Len: 0

No.     Time           Source                Destination           Protocol Length Info
     14 52.426849500   10.100.1.1            10.100.1.2            TCP      68     233 → 0 [ACK] Seq=28 Ack=8 Win=32768 Len=10

Frame 14: 68 bytes on wire (544 bits), 68 bytes captured (544 bits) on interface veth1-2, id 0
Ethernet II, Src: da:da:ef:3b:6a:ea (da:da:ef:3b:6a:ea), Dst: 3a:9e:db:aa:2e:df (3a:9e:db:aa:2e:df)
Internet Protocol Version 4, Src: 10.100.1.1, Dst: 10.100.1.2
Transmission Control Protocol, Src Port: 233, Dst Port: 0, Seq: 28, Ack: 8, Len: 10
Data (10 bytes)

0000  21 40 23 24 25 5e 26 2a 28 29                     !@#$%^&*()

No.     Time           Source                Destination           Protocol Length Info
     15 52.433623522   10.100.1.2            10.100.1.1            TCP      58     0 → 233 [ACK] Seq=8 Ack=38 Win=32768 Len=0

Frame 15: 58 bytes on wire (464 bits), 58 bytes captured (464 bits) on interface veth1-2, id 0
Ethernet II, Src: 3a:9e:db:aa:2e:df (3a:9e:db:aa:2e:df), Dst: da:da:ef:3b:6a:ea (da:da:ef:3b:6a:ea)
Internet Protocol Version 4, Src: 10.100.1.2, Dst: 10.100.1.1
Transmission Control Protocol, Src Port: 0, Dst Port: 233, Seq: 8, Ack: 38, Len: 0

No.     Time           Source                Destination           Protocol Length Info
     16 63.956131807   10.100.1.1            10.100.1.2            TCP      68     233 → 0 [ACK] Seq=38 Ack=8 Win=32768 Len=10

Frame 16: 68 bytes on wire (544 bits), 68 bytes captured (544 bits) on interface veth1-2, id 0
Ethernet II, Src: da:da:ef:3b:6a:ea (da:da:ef:3b:6a:ea), Dst: 3a:9e:db:aa:2e:df (3a:9e:db:aa:2e:df)
Internet Protocol Version 4, Src: 10.100.1.1, Dst: 10.100.1.2
Transmission Control Protocol, Src Port: 233, Dst Port: 0, Seq: 38, Ack: 8, Len: 10
Data (10 bytes)

0000  32 30 30 30 30 31 33 30 36 31                     2000013061

No.     Time           Source                Destination           Protocol Length Info
     17 63.973684819   10.100.1.2            10.100.1.1            TCP      58     0 → 233 [ACK] Seq=8 Ack=48 Win=32768 Len=0

Frame 17: 58 bytes on wire (464 bits), 58 bytes captured (464 bits) on interface veth1-2, id 0
Ethernet II, Src: 3a:9e:db:aa:2e:df (3a:9e:db:aa:2e:df), Dst: da:da:ef:3b:6a:ea (da:da:ef:3b:6a:ea)
Internet Protocol Version 4, Src: 10.100.1.2, Dst: 10.100.1.1
Transmission Control Protocol, Src Port: 0, Dst Port: 233, Seq: 8, Ack: 48, Len: 0

No.     Time           Source                Destination           Protocol Length Info
     18 95.739542024   10.100.1.2            10.100.1.1            TCP      68     0 → 233 [ACK] Seq=8 Ack=48 Win=32768 Len=10

Frame 18: 68 bytes on wire (544 bits), 68 bytes captured (544 bits) on interface veth1-2, id 0
Ethernet II, Src: 3a:9e:db:aa:2e:df (3a:9e:db:aa:2e:df), Dst: da:da:ef:3b:6a:ea (da:da:ef:3b:6a:ea)
Internet Protocol Version 4, Src: 10.100.1.2, Dst: 10.100.1.1
Transmission Control Protocol, Src Port: 0, Dst Port: 233, Seq: 8, Ack: 48, Len: 10
Data (10 bytes)

0000  70 6f 69 75 79 74 72 65 77 71                     poiuytrewq

No.     Time           Source                Destination           Protocol Length Info
     19 95.756304551   10.100.1.1            10.100.1.2            TCP      58     233 → 0 [ACK] Seq=48 Ack=18 Win=32768 Len=0

Frame 19: 58 bytes on wire (464 bits), 58 bytes captured (464 bits) on interface veth1-2, id 0
Ethernet II, Src: da:da:ef:3b:6a:ea (da:da:ef:3b:6a:ea), Dst: 3a:9e:db:aa:2e:df (3a:9e:db:aa:2e:df)
Internet Protocol Version 4, Src: 10.100.1.1, Dst: 10.100.1.2
Transmission Control Protocol, Src Port: 233, Dst Port: 0, Seq: 48, Ack: 18, Len: 0

No.     Time           Source                Destination           Protocol Length Info
     20 103.312714108  10.100.1.2            10.100.1.1            TCP      68     0 → 233 [ACK] Seq=18 Ack=48 Win=32768 Len=10

Frame 20: 68 bytes on wire (544 bits), 68 bytes captured (544 bits) on interface veth1-2, id 0
Ethernet II, Src: 3a:9e:db:aa:2e:df (3a:9e:db:aa:2e:df), Dst: da:da:ef:3b:6a:ea (da:da:ef:3b:6a:ea)
Internet Protocol Version 4, Src: 10.100.1.2, Dst: 10.100.1.1
Transmission Control Protocol, Src Port: 0, Dst Port: 233, Seq: 18, Ack: 48, Len: 10
Data (10 bytes)

0000  29 28 2a 26 5e 25 24 23 40 21                     )(*&^%$#@!

No.     Time           Source                Destination           Protocol Length Info
     21 103.325129383  10.100.1.1            10.100.1.2            TCP      58     233 → 0 [ACK] Seq=48 Ack=28 Win=32768 Len=0

Frame 21: 58 bytes on wire (464 bits), 58 bytes captured (464 bits) on interface veth1-2, id 0
Ethernet II, Src: da:da:ef:3b:6a:ea (da:da:ef:3b:6a:ea), Dst: 3a:9e:db:aa:2e:df (3a:9e:db:aa:2e:df)
Internet Protocol Version 4, Src: 10.100.1.1, Dst: 10.100.1.2
Transmission Control Protocol, Src Port: 233, Dst Port: 0, Seq: 48, Ack: 28, Len: 0

No.     Time           Source                Destination           Protocol Length Info
     22 116.762300420  10.100.1.2            10.100.1.1            TCP      78     0 → 233 [ACK] Seq=28 Ack=48 Win=32768 Len=20

Frame 22: 78 bytes on wire (624 bits), 78 bytes captured (624 bits) on interface veth1-2, id 0
Ethernet II, Src: 3a:9e:db:aa:2e:df (3a:9e:db:aa:2e:df), Dst: da:da:ef:3b:6a:ea (da:da:ef:3b:6a:ea)
Internet Protocol Version 4, Src: 10.100.1.2, Dst: 10.100.1.1
Transmission Control Protocol, Src Port: 0, Dst Port: 233, Seq: 28, Ack: 48, Len: 20
Data (20 bytes)

0000  2d 3d 5b 5d 5c 3b 27 2c 2e 2f 5f 2b 7b 7d 7c 3a   -=[]\;',./_+{}|:
0010  22 3c 3e 3f                                       "<>?

No.     Time           Source                Destination           Protocol Length Info
     23 116.769821627  10.100.1.1            10.100.1.2            TCP      58     233 → 0 [ACK] Seq=48 Ack=48 Win=32768 Len=0

Frame 23: 58 bytes on wire (464 bits), 58 bytes captured (464 bits) on interface veth1-2, id 0
Ethernet II, Src: da:da:ef:3b:6a:ea (da:da:ef:3b:6a:ea), Dst: 3a:9e:db:aa:2e:df (3a:9e:db:aa:2e:df)
Internet Protocol Version 4, Src: 10.100.1.1, Dst: 10.100.1.2
Transmission Control Protocol, Src Port: 233, Dst Port: 0, Seq: 48, Ack: 48, Len: 0
